id,document,label
7101987,철학적인 분위기의 영화. 솔직히 재미는 없어도 너무없다. 도무지 집중이 안된다.몰입까지는 바라지도 않는다.사람마다 가치관이 달라서 잔잔하고 여운남게 보는 사람도있을것이다. 하지만 쥔장은 이런 영화 노!! 디행히 여주의 귀여운 얼굴 때문에,0
8098297,김민종 최고! 더 잘되시요,1
9814882,유미영 : 제가 너무 멀리온것 같습니다 청장님.멀리가긴 뭘 멀리가. ㅡㅡ 개소름 발연기,1
8518399,딴따라에게 더빙을 맡기니 좋은 애니인데도 불구하고 평점이 이렇지 ㅉㅉㅉ,1
9084972,진짜무지막지하게재밋음ㅋㅋ,1
2432603,★★★★★X100 원작이 훨 낫지만 영화도 명랑하고 귀엽다 원작을 봤음 재밌을 영화,1
9371398,박세현씨 한국오고 예고편인줄알았는데8부작으로 끝났네요 넘 아쉬워요ㅜㅜ또 만들어주세요 이런프로넘잼있고 설레네요,1
6982798,ㅋㅋㅋㅋㅋ아는사람만 아는영화 오멘이나 데드쉽이나 진짜 무섭게본듯,1
6681974,능력없는 사회 패배자 주인공이 고양이하나 잘만나 공주랑 인생핀다는 쓰레기..거기다 더빙까지 쓰레기..,0
2783314,볼만한 트럭 액션 속의 밋밋한 캐릭터와 겉도는 배경음악.,0
2860760,놀래는거 하면 이거따라올만한게 없는듯 ㅡㅡㅋ,1
2956180,장난해?이게 재밋어? 이걸보느니 우리집에서 여성 의학 다큐맨터리를 보겠다,0
7460734,나름 괜찮게 볼 수 있는 영화,1
10153714,아 정말 영화내내 배우들이 악만 쓰네영화도 3류같고 배우들도 악만 쓰면 연기력 쩌는줄아는거 같음정말 한국영화 질떨어 진다,0
6398258,최악이다,0
9979475,"흔한 주제, 뭣같은 전개, 지루한 스토리텔링 한시간 반을 시궁창에 처박았다",0
8799475,슬픈 동화. 잔혹함과 로맨스도 없다. 울어달라고 애원하지도 않는다. 한국 애니메이션이 이렇게 발전했나 싶어 뿌듯하다. 안구건조증 예방은 덤.,1
9241541,이영화를 보지않고 미스테리 영화를 논하지 말라..,1
6048001,시청율저조한 이유를 알았다,0
5232102,최고의 영화,1
8463543,10년의 감옥생활동안 미경이 어떤 사람들을 만났는지 모르지만그녀는 소녀처럼 순수하고 맑고 따뜻했다.,1
8907676,재미있을 줄만 알았는데 재미있고 나중에는 감동,1
7640955,"감독이 말하려고 한 바, 그 곳.",1
8440989,아..다들 연기 너무 잘하시고 너무 재밋엇어요..조금 만 더 길게 만들어주셧으면 좋앗을것을 그게 너무 아쉽네요..특히 임시완군의 다른매력을 본것같네요..정말 연기력 짱!!!,1
9432257,탄식과 좌절과 감동의 연속...!!!,1
10233530,말이 필요없어...너무 좋아,1
9818014,남자랑 떡치고 즐길땐 좋았지 하여간 여자들이란 내가 남편이었다면 아내 살해 했을거다,1
5348349,그냥 포르노,0
215908,삶에 엄청난 활력소가 된 영화,1
6380866,무섭지 아나요^_^,0
9201525,다운받아 봈다. 개인적으론 공감한다. 저런 선생들 지금도 많다.하지만 공표영화와 잔혹하기만 영화를 착각한게 아닐까?,0
6876331,칸나가... 아니잖아 ㅠㅠㅠㅠㅠㅠ,0
2724125,재밌네 ㅎㅎ 엄마 말 잘들읍시다,1
10146742,완전 잘 봤어요^^ 진쫘루~~,1
10270290,중2병을 돋구는 기묘한 영화,0
9834326,2편이 잘 만들어서 그런지 별로다,0
9139970,장혁 연기 개소름....,1
9567854,이건 진짜 극장에서 봐야함~~!!생동감 있는 영상에 앙 몰입도도 짱~~!!^^,1
9169641,이영화를 보면 다른 영화들이 다 대작처럼 느껴질정도로 재미없다. 사색과 인생의 의미 어쩌구 하는데 이런식으로 풀어내는건 감독의 모험이다. 일부 매니아 층만 공감하고 즐길듯. 물론 영화보고 묘한느낌에 이런식으로 접근할수도 있구나 하는 생각은 든다.,0
8623244,포스터만봐도 소름끼치네 ㅋㅋㅋ,1
8680384,1점도 아까운 70년대스러운 영화,0
9766464,자극적이지않지만 추억도 생각나고 좋네요,1
9704561,소설을 읽지않아서 잘 모르겠는데 영화는 재밌었는데 얼른 다음시리즈 봐야겠다,1
7525477,나에겐 코미디였다 ㅋㅋㅋ 그냥 신선하니 잼있었다 ㅋㅋ,1
7523882,개연성은 개나 줘버려!,0
8612625,어떤 것을 시사하는 지는 알겠다. 문제는 교과서적인 대사들 지루한 컷신,0
8077712,I am a robot.,1
8565715,오랜만에 봤는데 요즘 영화보다도 더 재밌어요 마지막에 미그기가 미사일발사했을때 대신 전투기가 격추당하는 장면은 정말 압권이었습니다,1
9743520,특별히 다른 말이 필요 없음,1
9580265,평점 올려봐야지 ㅋㅋㅋㅋ,1
2204845,"유우의 매력. 전체적으로 잔잔한 감동, 그러나 뭔가 아쉽네.",1
9997911,이걸 보느니 일본야동 한편이라도 더본다. 마지막에 엑스맨 옛날손톱 갖게되는 새드스토리.,0
8251247,참 재밌네~~~~^^,1
10172759,간만에 SF다운 영화. 타워도 멋지고 역동적인 비행선도 괜찮음. 마지막 52호가 마무리 하는게 좀 공감이 안됐지만 전체적으로 굿~,1
9916303,"학원물의 대표작..,,",0
9310777,아... 별로...내용은 있는거 같은데..빨리 감기로 본 영화 ;;,0
5852911,느와르 더히어로 두영웅 이야기 재미있네요,1
8526683,라공이 연기 너무 못해서 재미가 떨어짐,0
9893488,여운이 많이 남는 영화입니다음악도 너무 좋고,1
5670689,"아기얼굴에 박명수 목소리란,,, 완전개웃김",1
10219170,조폭 형사 살인범 쳐나오는 한국영화들은 예전 영화들을 교훈삼고 반성해야 할것이다!!,1
5425642,내용 ㅈㅗㅎ다,1
7698029,아 내 시간 아까워,0
3135091,"내 기억에 가장 강하게, 오래 남은 영화임",1
2642476,영화판 서프라이즈 시청하는 느낌,0
10035323,사랑에 관해서 어떻게 이런 통찰을 ..,1
8675741,왜 흥행이 안됐는지 알겠군~ '0',0
6501445,이건 절대 깔수가 없다....오빠들 사랑해여 ㅋㅋㅋㅋㅋㅋㅋㅋㅋㅋㅋㅋㅋㅋㅋㅋㅋㅋㅋㅋㅋㅋㅋㅋㅋㅋㅋㅋㅋㅋㅋㅋㅋ 아 정말 오로지 팬심으로 별점준다 ㅋㅋㅋㅋㅋㅋㅋㅋㅋ,1
8504413,"정말 이러시면 안되는거잖아요.. ─━,,──━ㆀ",0
8899871,조선미녀삼총사 급으로 노잼. 한국이랑 미국이랑 내기함? 차라리 조선미녀삼총사는 이 영화에 비해서 연기라도 봐줄 만함.,0
9463851,내가 하면 로맨스 남이하면 불륜,1
6635649,별한개두 아깝다...이혜영 개발 연기땜에 졸딱망친영화..이혜영 연기하지마라..,0
8967911,한글제목과의 미스매치. 자꾸 끊기는 흐름. 떨어지는 개연성. 액션씬은 괜찮음.,0
8173669,....그냥 볼만하기까지만 하던데....,0
10146612,허허허 이거 진짜 출발비디오 여행이 편집 졸라 잘한거엿구나;;,0
7578735,망했어요,0
623080,이영아 넘 이뻐^^,1
9412001,극장 멸망을 초래할 초특급 영화가 시작된다!!,0
7312959,제목부터가 참,0
5892195,애절하다,1
10097344,아직도 생각나는 명작 또 보고싶다,1
4335714,진짜 이건 아니다 -_-,0
7974876,걸스데이는 도누구고 유라는 또 누구야 ㅋㅋ연기도 드럽게 못하고 생긴것도 걍 서프라이즈 조연배우 느낌나는데?ㅋ,0
7571904,진심...정말 여운도없고 재미도없고 감동도없음 그냥보지마세요 정말 왜이렇게 평점이높은지 모르겟네,0
525921,공포가 우습다,0
7904415,솔직히 이런게 32부작 이란건좀..굿닥터 재밌다던데... 좀 흔들리네요,0
8767126,생각했던거 이상으로 재미있게 봤네요...스릴도있고 반전도 있고 여느 한국영화 쓰레기들하고는 차원이 다르네요~제점수는요^~?100점만점에 95점드려요~~,1
9830180,지금시대에 더맞는 명작,1
9618172,하 ..진짜 재밋다 꼭보셈 마지막 ㅈㄴ소름,1
8558151,언제봐도 진짜 잼있다.,1
8881500,뭐지? 슈렉 1. 2 전부 수십번씩봤던 마니아인데 3가 나온줄도 몰랐고 3는 너무 재미없음ㄷㄷ,0
7696643,재밋음ㅋㅋㅋㅋㅋㅋㅋㅋㅋㅋㅋㅋㅋㅋㅋㅋㅋㅋㅋㅋㅋㅋㅋㅋㅋㅋㅋㅋㅋ,1
1350266,"이 대담함, 이 정교함, 이 슬픔",1
8923199,굿ㅂㄷㅇ푸몹보더ㄴㅂㅁ봇보,1
7367655,아 평점뭐야 진짜.... 마지막 장면빼고 지루했음,0
7206850,"볼 때 마다 눈물이 납니다. 당신은 떠났지만, 그 마음을 이렇게 나마 영상으로 보고 생각하게 해주셔서 감사합니다.",1
1678341,좋다.,1
4401435,로맨틱 코미디 아니었나봐요.. 정말 아닌듯,0
7590799,아름다운 영화,1
8387244,부패한 로마노프 왕조를 기리는 뭣같은 영화... 온몸으로 항거했던 러시아 민중들이 그저 폭도냐,0
8818034,시나리오 꼬라지 하고는...,0
7483790,진짜 대단함..퍼레이드장면에서는 입이 떡 벌어졌다. 화려한 색감과 정신없이 흘러가는 스토리가 좋다. 애니메이션중에는 최고라고생각함..,1
5218321,"꼭 필요했던 에피소드도 없고,결말도 완전히 망치고~진짜 돈도 아깝고 원작도 아까움.",0
8747962,그냥재밋게보면좋은그런영화,1
4383084,영화 끝나고 '모야 이거'라고 하는 소리들 처음 들었다 ㅋ,0
6895602,하 하하..,0
8496693,"장소좀 바꿔가면서 해야지. 바보 아닌이상 몇시간 촬영하는데, 눈치 다까지..",0
9653559,마지막에서 울컥했다. 결국 한명도 못구했단 소리....,1
9573259,별로 너무믿엇다 평점을,0
9731082,왜 이제서야 봤을까...진짜 최고,1
9330332,광고관련 영화라 보게 됐는데두시간동안 집중해서 재밌게 봤네요.여주 남주 외모가 훌륭하다능..,1
8404950,재밌다.시나리오가 탄탄한 영화이다.,1
8240842,아름답고 따뜻한 시선으로 가득하다,1
7185346,여러가지를 생각하게 하는 드라마,1
9899864,현실연애의표본+로맨틱코미디,1
5756244,헐 대박 서양에서는 저정도 외모가 미녀 대접받나봐 미녀는 개뿔 걍그런여자3명의애기,0
8213809,사와지리 에리카 나와서 봤는데...아 찝찝해.... 아쉬워.. ㅇ으으으윽 괜히봤다 남는게 없음 ;,0
3484334,인생을 풀어내는 그의 감각은 정말 훌륭했다. 역시 천재감독이다.,1
10079122,소재만 좋았다. 소재만.,0
2542275,이 영화를 보지 않은 남자와는 결혼하지 마라.,1
553296,도대체 이 영화 만든 의도가 머야,0
1180816,올해 본 일본 영화 중 가장 실망스러웠다,0
5296693,조니뎁 보려고 본 영화... 재밌다아 ㅋㅋㅋㅋ,1
10010629,와.. 소노시온.. 닥치고 10점,1
8474222,하 이명박....?!!!!,0
9873586,전개 방식이 너무 거지같다. 계속 툭툭 끊기고 몰입도 안되고..,0
7319779,대사가 너무 없어서 정황도 제대로 파악하기가 상당히 힘든 영화. 말하지 않으면 몰라요.,0
7520115,어릴땐 재미있게봤는데 지금보면 ㅋㅋ,1
9398230,정말 누가 ...중후반을 딱 잘라 편집시킨 느낌??,0
5147672,이 영화 진짜 재미있어요!! 3기도 봐야지~,1
7713270,방송 재탕 삼탕 사탕 우려먹는구나,0
5871703,tv판을 영화로 하니깐 역시 삼류 에로 ㅡㅡ,0
9989174,"신부님의 고귀한 삶에 10점을 드린 것이고 다큐영화적인 측면에서 보면 졸작이다. 그러나 내 삶을 되돌아 보게 해주었고, 앞으로 어떻게 살 것인가를 생각하게 해주었단 점에선 고맙다.",1
9206229,할말이 없어요. 별그대 이후 단연 최고^^,1
4541972,제프린 딘 모건에 반하다~ 너무 매력적이에요~ 영화는 유명배우들로 그럭저럭,1
8536418,연예인 단합 대회...,0
7270641,왕유치,0
2345905,이렇게 가슴시리게 본 드라마가 또 있을까? 감동 그 자체!,1
6741029,한창 사춘기던 중학생때 봤을때도.. 7년이 지난 지금에 봐도.. 감동은 여전하네요.,1
7559060,대부분의 게이캐릭터를 여자처럼 만들고 스토리도 이해되지 않는 부분이 많네요. 가족에게 갑작스런 커밍아웃을 한 뒤 상황도 제대로 풀지 않고. 그 친구가 죽는 상황도 너무 억지스럽고 보는 내내 참 지루했습니다.,0
2374076,암만 헐리우드 오락영화라도 운전기술밖에 볼게없다니.... 쯧쯧,0
9827222,"좋은 소재, 몰입없는 전개",0
45649,정말 유쾌! 상쾌! 통쾌! 위트가 넘치는 로맨틱 코미디..^^,1
4787845,완전 재미없어요 그냥..막장같기도 하고 레즈도 그렇도..돈주고 보기에는 조금,0
8665375,어떻게 한명도없냐 ???,1
3691082,이정도로잔인할줄몰랐다...요즘영화에비교해도전혀손색없을정도이다.,1
6122823,로왓 애킷슨 분이 많이 늙으셨지만 그 존재 자체로 충분히 배아프게 할 수 있다,1
308021,메인카피와 포스터로 관객을 사기친 영화네요.구속 해야 합니다.,0
7826171,"뭔말이 필요할까 ,, 뻔하지 않은 비쥬얼 , 스토리, 영상, 센쓰 돋보이는 영화 ! 그냥 보고 또 봐도 질리지 않고 잼잇는 영화 ! 다음이 기대되는 작품.. 인데!!!",1
5791407,가슴이 시리네요..,1
4050297,ㅋㅋㅋ마리화나ㅋㅋㅋ엄청재밋엇음!!2도빨리봐야지 ㅋㅋㅋㅋㅋ,1
5763166,50센트가..조연이네 연기도 못하는게 주연인줄알았는데 주연은 10분출연 ㅋㅋ,0
9970073,"[ 스토리 3, 비주얼 3, 연출 3, 연기 4 ] 혈액형에 대한 오해와 편견.",0
5635107,삽입곡들도 참 좋았었던거 같은데...이제는 들을수 없는건가..,1
10193072,한 10년전쯤에 이영화가 등장했더라면 참으로 좋을뻔 한 영화다. 어디에선과 보는듯한 전개와 결말이다. 그게 조금 아쉽다. 영화 자체는 나쁘지 않다.,1
6064549,이렇게 재미없는영화는 또오랜만.... 평점이너무높은듯,0
9469011,이게.걸작.이라고? 크리스마스시즌에 봤는데 진짜 크리스마스의 악몽이었다 노잼을 넘어선 화나는 수준,0
4716325,좀 짱인듯?,1
7522460,ㅋㅋㅋㅋㅋㅋㅋㅋㅋㅋㅋㅋㅋㅋㅋㅋㅋㅋㅋㅋㅋㅋㅋㅋㅋㅋㅋ,0
3353889,짜증만 나는 별로임..,0
7369377,김보성의 으리!!,1
9486434,"영화화 할 만큼 인상적이거나 흥미로울 원작도 아니지만, 결과적으론 브루스 로빈슨에게 연출, 각본을 맡긴거부터가 문제였다. 흥미라곤 눈꼽만치도 찾기 어려운 영화",0
7779957,줄거리 다 읽으니깐 영화 한편 본 것 같네..ㅋㅋㅋ,0
10152226,한번쯤은 꼭 봐야할 많은 것을 생각하게 해주는 영화. 개그는 두말할 것도 없고ㅋㅋㅋㅋ,1
3927721,빵빵 터짐ㅋㅋ 레오 히스테릭 쩔어~,1
8572237,쪽바리 친일들 많네 대한민국에,0
7461567,강력한 신자유주의 정책으로 영국의 서민들을 몰락시킨 독재자 보다 더한 사람을 메릴스트립이라는 배우로 미화시킨 치욕스런 영화,0
8604605,수박은 물이 될 수 없다. 식욕은 성욕을 채울 수 없다. 섹스는 사랑을 채울 수 없다.,0
7998125,6개월 대장정~~ 모두 수고하셨습니다~~^^. 마지막회도 본방사수 할거예요~~^^. 파이팅!!,1
5472907,춤잘추는 현준은 지내나라사람이라 우기겠지 중국놈들 ㅉㅉ,0
10127277,일본영화는 애니바께 안보는데 그냥 끌려서 봅니다,1
6076468,좋아요,1
7509998,"진짜 웃기다 ㅋㅋ 류승범떔에 봣는데 진짜 여기나오는애들다 개병,싄같아서 깔깔거림ㅋㅋㅋㅋ",1
9052737,"남한이 뭡니까 ... 한국, 대한민국이라는 엄연한 국호가 있거늘.. 해석이나 설정이나 ...쩝 ㅡ.ㅡ;;",0
2089319,어렸을때 공중전화만 보면 흥분했던 기억.,1
2980143,다시한번보고싶다.,1
5741304,시사회 때 보고 나니 진한 여운이 남네요. 작은 영화들 힘내세여.,1
7858066,불안함에 잠식당하다,1
4001920,shit,0
833372,OOO,0
8830984,한국 최초의 컬러영화니까 10점ㅋㅋ,1
6193911,오글거리고재미는개뿔... 러브스토리도 지루해서 하품만..,0
7154587,잼,1
4526918,제목만 들어도 영화가 떠오르는데... 삼가 고인의 명복을 빕니다..,1
8165804,먼데 ?이거...장난해??,0
7440852,마티...세계적으로 가장 유명한 롤링 스톤즈팬이 도대체 뭐하고 계시는 건지...네?감독님?대답좀 해주삼.제 이메일로 알아서~오케이?(웃음),0
9137990,시작부터 노답. 군법위배되는 바이크를 공군장교가 타고 머리 햐 대위짬밥에 머리가 저렇게기냐 ㅎㅎ 공군이보면 개빡치겠다 15분만에 채널돌림 ㅎ,0
3588939,소비가 있어야 경제도 활성화되지만 이런 영화는 왜 만들까?? ㅋㅋ,0
4772992,"영도,남포동,자갈치시장,국제시장 등등 가보고싶다..",0
2113079,good,0
5574880,"이건 이것도, 그것도 아녀",0
954335,나름대로의 분위기에 4점 준다.,0
8060548,'황금의 제국은 없다'는 걸 온몸으로 보여준 명품드라마~!!,1
6991976,꽤 잘 만든 드라마. 조안 이란 연기자를 첨 봤네요. 두번째 보고 있는데 연기를 생각 보다 잘 하네요.,1
8462016,터미네이터라는 신성한 이름에 똥칠해놓은 짝퉁,0
595023,한국에 태어난 걸 감사하게 만들어준 영화.,1
1468022,지루하고 따분하긴 했지만 색다른 시점의 영화라 신선했다.,0
9972772,왜 0점은 없는 것인가. 징그러울 정도로 재미없는 드라마,0
5329967,십라,0
10117301,완전 팬 심으로만 보려고 했는데 예상외로 넘 꿀잼임,1
4658979,제니퍼 코넬리 외엔 봐줄게 없었던...,0
7345815,평점 조절용 5점정도가 정당하다.,0
7181055,걍최고입니다,1
8050325,고려말 조선초 역사에 관심이 많아서 끝까지 참고 봤지만 작가의 상상력이 도가 지나쳐서 역사왜곡으로 보여졌다. 의상소품이 너무 화려하여 패션쇼를 보는 느낌..역사극이 이러면 안되는데.. 가벼운 트렌디 시트콤 만들던 사람이 갑자기 사극을 만든 느낌,0
5772537,이영화 어쩌라구..지루하게.. 라이언 일병 이후로 전쟁영화 재미있는걸 못봤다,0
9454737,진심 최고 역대금임ㅋㅋㅋㅋ,1
9609819,"마지막에 에바가 케빈을 껴안았을 때, 케빈의 눈빛을 잊지못한다",1
9767219,호불호가 갈리는듯 가볍게 보긴 좋음 애드리언 사랑해ㅐ!!!!,1
6762013,아 뭐야이거 황당해;;; 갑자기 끝나네 발단발단발단발단결말 ;;; 기기기결;;;; 뭐양,0
7664303,콘돔생각하고 제목을 이따구로 지은거면서 아닌척은,0
7367197,"졸작이지만 서극이 감독을 맡고 서극 본인을 포함해 오우삼, 정소동, 왕정 등 유명 감독이 대거 카메오로 출연했다는 것이 특기할 만함. 장만옥의 20대 후반 무렵 청초한 미모와 이연걸 부인 리지의 관능미 넘치는 육체가 눈요깃거리 되는 정도.",0
8142693,"올해 최악의 프로그램, 최악의 제작진, 최악의 심사위원, 최악의 교차편집. 결과는 아웃오브안중",0
3200603,진짜 감동먹었음 ㅋㅋㅋㅋ,1
6575311,굳,1
9698046,좀 신파가 있긴 하지만 그래도 충분히 감동적으로 잘봤다. 확실히 스티븐스필버그의 작품은 기본이상은 해주는듯. 말그대로 군마가 주연급 출연하는데 감정이입도 상당하다,1
8834688,스타워즈는 다시봐도 언제봐도 재밋음 !,1
8808026,1점도 아깝다 정말 요근래본영화중 제일구림,0
10158532,우연히 봤는데 스토리가 하도 어이가 없어서 보다보니 별 미칀;; 이말이 나오더라 이런 개막장 스토리 첨보고 어처구니 없어서 어떻게 끝나나 보자하고 끝까지 꾸역꾸역 본영화 생각보다 평점 높았다는게 신기;;;;,0
1589765,건방져..............건방,0
7871594,오락성도 떨어지고 특수효과도 떨어지고 뭐 하나 맘에 드는게 없는 영화,0
5737029,더 뮤지컬 제작사 필름북은 체불임금을 해결해주세요,0
8650541,주옥같은 곡들이 많이 나오는 영화를 이제서야 봤네요...,1
5352069,내 살다살다 이런 발영어에 발연기들은 처음 본다.,0
9981752,네버엔딩 444 지구멸망때까지 사수하라.,0
10159013,그는 신이였다. 엘 시드!,1
9915021,어렸을때 너무 좋아해서 비디오로 계속 봤던 영화. 다시 좋은 화질로 보고 싶네요 그 a whole new world 듀엣은 정말 환상적이었습니다.,1
8673898,웃겨 키드키득키득 임창정 연기력 폭발 송지효 너무좋타,1
5535899,몰입이 영.. 이런류의 영화들은 똥폼잡는건 여전하구.. 그냥 별루였음.,0
10268297,유럽영화 특유의 특이함? 사고가 병맛같은사람들? 얘기에요. 재밌는데 다만 행동들이 답답하고느리다고느낄수있음. 정말 많은나라에가보고 인맥쩌는 알란이 부러움ㅠ 수용소에서1년허비했어도 알찬삶을살았네요 역사도 배움. 젊은사람도 시골에서특별한직업없이사는서양ㅎㅎ,1
8034196,ㅇ 당연한거지 ㅋㅋ 엑소령화,0
5946893,인물들 너나 할거 없이 욕이 절반이고 바티스타 담배피는 씬이 절반임ㅋㅋ실망,0
10126819,뛰어난 연출과 배우들의 명연기~ 명작입니다,1
7528150,제목캉 평점에 낚인 내가 한심. 해피해피브렌든가 하는 영화 이후 이런 어처구니 없는 네이버 평점 영화 첨 봄. 주인공들이 못 생기기까지 했어 망할,0
9440461,명작오브명작이것도재개봉했음조켓다,1
8926149,이건 좀 심하게 아니다감독양반,0
9791216,여배우 슴가 보고파서 만든 영화..스텝들이 나 이영화 만들엇는데 잘만들엇지 ??말 할수잇을까?? 하는영화,0
5342831,마이크하고리버가어떤일정부분상당히겹쳐보인다는것그래서더욱슬프게다가왔더라는.,1
4147564,지루한 면이 없지 않다.하지만 훌륭하다,1
10214732,오집니다 정망~~~~,1
4362000,각 에피소드별 다른 느낌 모두재미있었지만 제게는 첫번째 에피가 가장 괜찬은듯~,1
6080069,전혀 배드하지도 않고 그냥 그래요,0
5961135,관심을 가져라!,0
6351877,진짜 상OO같은 영화,0
6896315,이런영화안좋아하는데티비에서해주길래봐봤다.내용은없고계속죽더라ㄲ앞뒤없이일단죽고봄.그냥잔인한거보고싶으면봐도됨.,0
10074062,젊음..청춘...지금 이 순간의 소중함을 일깨워줬네요.,1
10264741,순수하지만 억눌려있던 백조로 시작해서 일탈과 자유의 흑조로서의 자신을 발견하고 이 둘이 조화 됨으로써 완벽한 내가 된다.,1
10043222,"정말 지겹군 다음은 마드리드에서 온 여자, 대구에서 온 남자 인가?",0
8223220,별한개도 아까운 드라마 ㅋㅋㅋ작가가 관종자인가봉가 ㅋㅋㅋ,0
8622522,영화관에서 재밌게 본 기억이 난다,1
3608323,정말 재밌어요~~,1
10231596,"스토리, 액션, 연기 등 아주 별로임.",0
3623151,정말 최악의 영화였다. 욕 먹을 각오하고 남길정도니..,0
8625352,리뷰때문에 한번 보고 싶긴 하다,0
8018608,한마디로 걍 쓰레기같네요. 연출 편집 의도 출연 기타 등등 모두다 ㅋ,0
9708643,깔끔하다. 문제없다. 엑싯뮤직 una mattina는 절정이다,1
10152184,노잼노잼노잼노잼노잼노잼,0
8682859,별 볼 일 없는 한심한 사랑 놀음,0
8617351,이시간에 왕가네식구들 다시보기 보는건 처음이다,0
8062384,굿ㅜㅜ3번정주행중..지진희씨에게빠졌습니다,1
9130651,아프리카의 풍광과 아름다운모차르트음악이너므좋았다,1
9106903,최악의 쓰레기 영화다.,0
7897170,추천합니다,1
154913,머냐? 이영화~ 차라리 꼬꼬마 텔레토비를 추천한다.,0
3783485,아 잼슴 ㅋㅋ 이거 나오고 몇일 있다본,1
2605085,정말재미있고 여성을이해하고 아줌마를이해할수있는영 여자친구랑다시보러가야지,1
10212329,컨저링을 먹칠한 영화 컨저링의 공포의 반도 따라가지 못함.. 개인적으로 DVD 까지 사서 봤는데 나의 기대를 배신했음.,0
9705905,동화같은 스토리와 아름다운 구성... 책을 읽으며 상상하던 그대로의 배우들의 모습이 너무 좋았다^^,1
5807925,어렸을땐드립하지마라언제까지그럴꺼냐 태권v도 그래징가짝이면서계속리메이크하는데,0
2952747,에덴사랑합니다ㅋㅋㅋㅋㅋㅋㅋㅋ,1
7260583,어덯게 개봉한영화에14명밖에 평점을않다냐...,1
7546367,대박이지,1
6175647,짝퉁 왕국의 오명이 부끄럽지도 않나? 정말 이건 아니다.,0
6453779,아 이거 진짜 재밌었는뎋 ㅋㅋ,1
3402389,지루................,0
2092253,아라레 돌아다닌다 맞아요 홍금보 원표 성룡 짱짱짱乃,1
2927033,"어렸을때 참 재미있게 봤는데, 다시보면 어떨까나?",0
7411706,1개도 아깝다.볼때마다 얼마나 더 재미없어질까 싶음,0
7718492,시즌 2도 기다리고있을게요~예전부터 이런예능 기다렷었는데 넘넘재밌고 각각 라운드마다 제가 생각지도못한 게임과룰보는재미 출연자들끼리의 심리싸움 보는재미 아 그냥짱♥♥♥♥♥♥♥♥♥♥,1
9507245,어린이들이여. 이 영화를 안 보고도 스스로를 홍대피플이라 말하지 말라.,1
5690130,쓰랙,0
5309659,"""""""내가(이사회가)다시시작할수있을까""""희망은소나타같은것또결코신화적인게아니다.""",1
6049170,정신나간 영화2,0
3995292,별하나도 아까워,0
9238973,완전 빵 터짐 ㅋㅋㅋ 자막으로 보세요,1
9286246,아.. 여주 암걸림 개 암덩어리,0
