id,document,label
1357122,↓공감. 스타워즈가 졸작처럼 느껴지게 만드는 영화다.,1
4852778,요즘젊은이들은 이영화 출연배우들이 얼마나 초호환지모르겠지???,1
6511816,찍은 목적이 뭔데? 너무 재미없다,0
6330899,정말 별로네요...,0
9218592,"재미없을거같아서...지금껏 미루다가 오늘에사 봤네요~! 정말 애쓰셨구요...디ㅡ븨디로 보니...촬영할때 정말 힘든점이 한 두개가 아니던데...그걸 이겨내고 이런 좋은 작품 만들어주셔서 감사합니다!~앞으로도 좋은 연기 , 좋은 작품 계속 만들어주세요~*",1
9622696,좋아요!!!좋아요!!!,1
4973692,사람들이 보지마라고하면 그냥 보지마세요.굳이말리지는 않습니다.,0
8464465,참 굵직한 배우들로도 어떻게 안되는 영화가 있긴있구나...-_-;;,0
8782859,적절한 평점은 7.4정도 된다고 생각함,1
9967397,추억돋는 영화.. 정말 아름다운 영화.. 자극적인 내용도아니고 잔잔하고 배우들도 좋음.. 이 영화를보면 그시대가 떠오른다.. 그때의 나의 젊은날도 생각나고..그립고.. 이름만들어도 참 좋은영화.. 요즘은 이런영화가 나오질 않네...,1
9091527,스토리도 빈약..유치하기 짝이없는 내용. 진부한 억지설정.과도한 정치색(좌빨)시간아깝습니다 진짜..ㅋㅋ,0
9852413,졸리다.스토리나 에피소드가 몰입도가 떨어진다.~졸음을 참으며 봤다.,0
10104189,영화는 머 인정ㅋㅋ실화니까 근데 난 무섭지는않앗음...,1
9136276,일본 우익의 시각을 보여주는 영화 대단하네...보면 말이 안 나옴.. 미군 준장 넘도 군인 일병보다 못한 놈이네,0
9658713,잔인하기만 잔인하고 시간아깝다,0
1515119,할 말 없다.,0
6290192,간디가 간디언젠디... ... ... 개봉했음?,0
9502978,정말 몰입도 최고의 흥미로운 소재의 영화군요.!!!후반부에 살짝 루즈하긴 하지만 수준급 영화입니다.^^,1
9120792,잊혀가는 전쟁후 복구시대를 배경으로 따뜻하고 끈끈한정을 느끼게 해줬던 순금의땅을 매일 볼수있어서 감사했어요~마지막회도 훈훈하게 마무리되어서 잔잔한 여운이 진하게 남아 오래도록 기억될듯^^,1
1829006,아놔...어쩔거야...ㅠㅠ,1
4423397,로버트 패틴슨을 다시보게된 영화. 내면연기를 너무 훌륭히 소화해냈다.,1
8801835,조승우 매력 터진다ㅋㅋ 이거보고 조승우 팬됨ㅋㅋ 기동찬 사투리가 계속 들려 미치겠다ㅠㅠ,1
8566497,애니다운 맛이 없는 조악한 이야기,0
695210,뮤지컬영화라고 하기엔 상당히 졸리다...,0
4200687,아역배우 때문에 짜증나긴 처음~ 영화지만 아역배우 말투를 실제 애들 배울까 겁난다,0
8649083,재밌는건 재밌는거여!,1
10229635,내가하면 로맨스 남이하면 불륜,0
416218,굿!!!!!! 김청기 감독님 존경합니다.,1
3041616,지루함의 극치.. 평점에 낚이지 말자.. 딱 4점임..,0
9414942,이거 엄청난 영화네.. 나는 제5원소 할때마다 안봤는데 오늘 슈퍼액션으로 보고있는데 이런 영화를 1997년에 만들었다니... 말도 안돼 최곤데,1
9055405,도대체 그 남자에세 백x지란 무엇이었길래... 그리도 분노를 터뜨리는가. 그남자의 과거를 알고싶다. 아.. 트라우마여~,0
10102599,이영화는 클레멘타인이후 최고의 작품이다...지금도 귓가에 맴도는 소리...슈파슈파슈파슈파,1
3404143,어릴떄 비디오로 빌려봤지 ㅋㅋ 추억의영화 ㅎ,1
5812126,결말이 비극적이구만....애처롭다...,1
6267570,영화보다가중간에댓글쓰긴처음이네.주인공은 어디서구한거임?? 개발연기제대로네,0
9155330,쓰레기...개ㅡ레기,0
10016615,이정재연기는 정말 이영화가 최고인듯 합니다 흠잡을게 없는영화 이지만 한고은때문에 영화가 망쳤습니다 특히 어? 코피나~~ 이대사 할때 진짜 어이없는 웃음이 ㅋㅋ 연기를 발로하신듯,1
7161763,이영화 한마디로 표현하자면 고자전쟁!!,0
5907932,지루 그자체,0
9621081,웃기기보단 보는 사람도 답답하게 한다,0
7798528,10점만점에 10점~ 최고의 갱영화다. 진짜,1
7460178,진짜 드라마 막장... 30녀 살면서 이런 막장 드라마 첨 봄.. 글고 왜케 질질 끄는지 ...,0
9008589,이 영화를 이해하기엔 어린 분들은 좀 난해할지도..남자환자들에게 여자 보호사가 저렇게 몸을 비비고 해서 신체가 나아진다는것은 유명합니다. 제 지인도 저렇게 해서 몸이 좋아졌구요. 이런 배경지식이 있어야 숙희의 행동이 이해될듯합니다. 숙희연기짱..!,1
7485126,20전 나의 모습을 돌아볼 수 있는 영화이네요.직장생활하는 남편도 힘들지만 우리 아내들이 얼마나 희생하며 사는지......정신없이 살아가는 분이라면 이번주말엔 부인과 함께 손잡고 볼 만한 영화입니다.,1
8823281,"오랜만에 잔잔한 로맨스~ 우리도 사랑일까? 이런 영화 생각나네요, 여튼 넘 즐겁게 관람했습니다 :)",1
9900304,문연다음이 더 궁금한데...,1
9549945,그의 펜이 되었다...,1
10127289,잊혀지지 않는 영화. 이 영화만의 독특한 코드가 좋다. 함께 보며 웃던 그녀도 잊혀지지 않는다.,1
10114675,이게 7점대라니 말도안돼서 10점 주고 간다.ㅠ 정말 좋아하는 공포영화. 명작임..~,1
2979753,행복한영화다 ㅠㅠ,1
8046781,나름 갠춘했는데 평점이 박하넹.,1
10103810,보고또보고 계속반복. 평점주기위해 로그인함,1
6401944,"아,...-_-지루해",0
2809648,대박 ㅎㅎ,0
6630851,아 진짜 스릴 긴장감 제로.. 반전도 억지로 갖다붙혀서 이게 도데체 뭔지.. 세월을 피하지 못한 반데라스형님 안타깝네요,0
5557388,"구시대에나 맞는, 주제도 그런, 캐스팅도 그런 작품",0
9698968,정말 기대이상으로 최고의 영화시리즈! 은의자가 무척 기다려진다~~,1
6269230,여름에 물총들고 찍찍 쏴대도 저영화보단 잼있게 찍을수 있음,0
895338,"미국판 여친소. 소니, 피자헛 광고가 끊이지 않음.",0
7704656,우리에겐익숙하지만 누군가에겐 잊을수없는 아름다운일상,1
6988146,멋잇다,1
5184649,인내심을 시험하는 영화...,0
3333229,저질,0
6344833,"억지 웃음, 억지 감동.. 보는내내 오글오글...",0
2660871,엄청 바람이 불지만 시원스럽지 않다.,0
9987424,소재는 좋은데 내용은 짜증 유발,0
6267056,용우태웅이연기력개쩐다.but 박용우캐릭이 얄밉고 띠겁게 나와서 계속 욕하면서 봤음.,1
8570006,평점이 너무 높다 이정돈아님,0
10047345,정상적인게하나도없네.이쯤되면 이감독 남자ㅡ아버지한테 성적학대를당했거나 남자한테성적으로상처받았거나게이이거나. 소수자들의얘기를담는영화가많다지만이건좀아니지않나 자신의성적판타지를 주입시키는듯,0
8660950,이거 생각보다 감동스러운영화내여,1
9126522,아키라 죽었나보다.. 외화벌이때매 아키라사칭해서 작품내는거아녀?,0
8653370,자국 포로들을 생각하면..별로 공감이 되지 않았습니다..,0
6310838,뻔한이야기 어떤 사회던 있는자와 없는자만 존재할뿐 쉬운이야기를 장황하게 풀었을뿐,0
9554040,평온한 가족들의 모습에서 더 소름이 돋았다.,1
10069545,일본애들은 TV드라마로 만들어도 안 볼 이런 영화를 뭐하려 필름 낭비하며 만드는 걸까.. 신기한 것들이네 진짜..,0
3038059,실패작.........,0
7409441,혜교는 예쁨,1
1362767,브레이브하트가 될수 있는 기회가 있었는데... 배우가 아깝다,0
2378009,wow wow wow,1
9587674,향기 같이 남는다. 좋은 영화,1
3516565,마음이 짠하고 여운이 길다.,1
6005461,완전 재미無,0
7472956,그들은미친게아니다.미친척을한뿐,1
6643576,좀 유치하긴하지만 애니라도 느끼는게 많은 영화다 ㅋㅋ기광오빠 목소리 황홀했어요 ㅋㅋ,1
9112553,"코난도일의 셜록홈즈와는 괴리감이 매우 크다. 너무 심한 각색, 맞지 않는 배우 선정....셜록홈즈의 캐릭터 이름만 가져다 쓴 가벼운 액션영화수준이다. 소설을 안읽어봤거나 소설을 봐도 별 흥미를 못느낀 사람에게만 추천한다. 영화 퇴마록 수준이다.",0
1207205,힘든 사랑이었기에 far from heaven..,1
1884655,영화를 이렇게 독특하게 만들다니... 대단하다,1
9268003,이게 2편이 나왔어???,0
1228688,다른 말 필요없습니다. 일단 보세요. 그 감동은 못 잊으실걸요,1
9291165,전작과 함께 재미있게 본 액션영화.,1
9043617,개인적으로 가장 인상깊게 봤던 영화,1
8952803,그래서 이 영화에 유리는 무슨역활인거죠,0
9426266,TV드라마 보다도 내용이나 촬영이나 나은것 없는 졸작. 그냥 TV인기 업고 대충 만들은듯.,0
9206546,평점에 당했다....꼭보시길...,1
9297232,최고의 액션 액션의 정석,1
7014080,"닌자에는 어울리지도 않고 연기력도 별로인 여주인공, 심하게 단순한 스토리, 개연성 떨어지는 심리. ...제작비는 꽤 들인 것 같은데 영화 수준은 심하게 별로다.",0
9676632,무거운 침묵이 주는 강렬한 충격. 우린 너무 많은것을 '말하며'살고있다,1
2259841,이게 영화냐?,0
10227817,아OOㅋ ㅋ ㅋ그래픽처음다루는새.끼가더잘만들겠닼ㅋㅋㅋ,0
10096284,생뚱맞게 서로 말한마디 안하고 성관계 ㅋㅋㅋ골떄리네 진짜,0
6580205,영화를 보는것만으로도 마음의 휴가를 다녀온 느낌.소박하지고 잔잔하지만 지루하지않은..그래서 다시 보고싶은 영화.햇살가득한 비이의 부엌과 요리도 인상적,1
5125454,재작년에봤는데아직도기억에남는다,1
10238856,어떤 장면으로 나를 어이 없게 만들지 계속 기대하게 만든다. 실망시키는 법이 없이...계속 참신한 상황이 나온다.,0
7713083,쓰레기 연예인 재기의 장~~그러나...,0
3509521,여기에 반전 조차 없었으면 더 망했을꺼 같은데?,0
7878205,표절냄새,0
3542485,말이 필요 없다.!!,1
9284935,치열하게 불꽃처럼 살다가 원치않는 이별을 고하게 되기까지..왠지 은퇴작의 분위기가 나는 영화네요.,1
6836224,보다가 오그라들어서 소름돋았다진짜어휴... 10대소녀용인가? 20대남자감성이랑은 절대 안어울린다 ㅋ,0
4773529,평점겸허하게 받아들이시고 시날 작법책 한번 더 보세요. 쯧,0
8202167,한 15년전에 본거 같다 그때 쇼킹했던 기억때문에 다시 한번 봤는데 그당시에 그냥 보는거랑 지금 나이먹고 이해하면서 보는거랑 차원이 다르더라 몰입감 최고 공포영화중에 최고라 자부한다,1
4097133,동감일세....12이상관람금지,0
6932770,"가슴이 따뜻하다 미어지다하네요 소재는 별루라 안보려다 계속보는데 보길잘한거 같아요. 우리 할머니,할아버지,아버지,어머니,형,누나,동생얘기가 될지도 모른다생각하니 더 싐취해서 봤습니다. 가슴 저 끄트머리까지 짠해집니다",1
7411498,느와르의 교과서,1
3317231,재밌다ㅋㅋㅋㅋ,1
8864851,진짜 말이 필요없다 진심,1
9724908,멋진 그래픽속 똥망 스토리.,0
3876297,ㅋㅋ대박인데 반전내내 생각했는데..대박..,1
3382640,닥치고 김사랑 차냥,1
9957468,사랑해 본 사람이 느낄 수 있게 아주 잘만든 영화..다들 최고라고 생각할거다,1
1461635,사은품으로받은 DVD...내가 이걸왜봤지?..,0
8497399,무슨 메시지를 전달하고자 그토록 배우들이 다 벗고 나오는지 지금도 알 수 없음,0
9091587,재미없다 이것도 드라마라고..,0
9529146,정말최고였어요~ 콘서트의 생생한 현장감이 잘 전달됐습니다~,1
7920325,"""민주팔이사기꾼들의 선동질영화...민주팔이들때문에 한글에서 제일 짜증나는 단어들이...""""민주,서민,평화"""" 다......""",0
5525256,tv에 하길래 봤는데 재밌어서 계속 본 영화..,1
5757151,역시 실패한 좌빨들의 혁명은 지금 보면 그저 정신병자들의 발작적 향연에 불과하다ㅋ,0
7749553,1점도 아깝다. 쓰레기 영화. 킬링타임이란 단어 써주기도 아깝다. 존나 어이없는 영화. 씨발영화,0
9828481,이런건 극장에서 봐야 더 재미있는뎅,1
2978645,"잘만 만들었음 꽤 괜찮았을 소재.. 연출과 각본, 배우의 부재가 아쉽다",0
8742390,코미디중에 최고임 ㅋㅋ,1
7269202,굿굿!,1
9788582,아 재밌긴 재밌는데 스파이 둘이 좀 비슷하게 생겨서 얘가 얘고 쟤는 쟤다 계속 생각하면서 봤음 처음볼때 진짜 헷갈렸음,1
9823995,너무한 영화다....,0
9835911,보는내내 화가나는건 나뿐인가. 이걸 사랑이라 할수있나. 한낱 인간의 더러운 욕망과 치부일뿐.,0
8279243,오랜만에 울 수 있어서 좋았던 영화. 보는 내내 안타까움이 엄습했던.,1
1961288,대근이형 역시 최고!!!!,1
8076110,나만 당할수 없지요. 문재인 out,1
5011640,헐~~ 여자 주인공이 80년생이었다니~~~~,0
10256992,쩐다..이런 영화 더 나와라..,1
9772369,감동적이예요. 많은걸 느끼고 2015년에도 이런 일이 일어나고 있다는거에 참 안타까운 마음입니다. 꼭 보세요.,1
2633178,캐스팅이 이렇게 완벽할순 없다.. 해피엔딩을 위한 알콩달콩 과정들이..,1
2797689,정말 이렇게 기발하고 창조적으로 재해석한 멋진 게임 원작 영화는 보기 드물었죠! ^^,1
4787965,아즈미가 땀을 안흘려~! 1편보단 재미없다.,0
2217396,이거 진짜 잼게봤다 ㅎ,1
9362147,영화가 많이 심심하다!!!!,0
3654806,세훈이형짜증남ㅠㅠ,0
1119483,촬영장소는 1976년 돈암동 깨라벌중고등학교,1
9417706,이정재의 연기는 가히 최고라 할 수있다,1
8266086,길냥이를 키우고십고 한편으론 씁쓸함,1
9287412,다시 보고싶은데 볼 길이없어요 아무리찾아보아도ㅜ 아련한기억들,1
8489966,갑자기 바뀌고 재미없어짐예전에 여자들이랑 엄마랑 같이 나와서 토크하는게 훨낫지 이거뭐 노잼으로 바뀜 이제안봄,0
3044111,약 4조 원의 재산을 소유하고 있는 것으로 추정되는 아놀드의 영화,1
9182859,이게 뭐야 도대체;;;,0
6344222,현실과 환각 사이를 오간다. 정신 없다.,0
10273727,꿀잼이었던 같아요ㅋㅋ,1
3584920,탁월,1
10276132,역시 판타지는 너무 잼있어!반지팬으로써 10점,1
5279234,김태우 나와서 봣는데.. 앞으로는 김태우 나오는 영화라도 다 보면 안되겠군여,0
728832,바니가 모든 건담주인공중 최고다!!!,1
394252,sf면 뭘하나? 감독의 시선은 조선시대이건만.. ㅡㅡ,0
7797826,보지마세요 보시면 시간낭비,0
9683214,가슴 울리는 최고 영화 유아인을 좋아하게 된 계기이자 완벽한 배우들,1
9618670,좋은 소재에 만족할 연출.,1
3091554,예전에 재밌게 봤는데...,1
7541397,레슬리같은 의사라면 10억을 주어서라도 주치의로 삼고 싶다ㅠㅠ,1
2190720,이제 나까지 속이는구나...육체적본능과 거리멀다.,0
9716501,뿌지지지직 뿌직 뿌우우웅 뽀드득 쿠득푸드드득 파닥..뚜르ㄴ득 퍽덕..툭..,0
10035149,원주율을 위해서....,0
9728544,조니뎁 능청능청 연기 완전 좋음..ㅋ큐ㅠㅠㅠ,1
7739600,긴장감도없고 허술하고. 사람죽이는거야 다 잔인하다 여기지만...공포감은 50년대 드라큐라보다 못함..,0
9484096,방송인이 우승하니 역시 재미 격감. 마지막 게임은 특히 찝찝하고..,0
6232691,이정도면 봐줄만 하다,1
1066606,설수진 너 ㅇ.ㅇ 이표정 압권이었어,1
5859382,"진짜 어두워서 잘 보이지도 않고 몰입도 안되고,,이거 뭔,,",0
5908396,정찬 연기만 돋보이고 시나리오부터 부실.,0
7011829,굿짱 너므재밋다,1
6838307,아니 캐서린 모리스를 모르나? 왜 이름조차 안나오는거지 포스터에는 대문짝만하게 나오면서 조연으로도 이름이 거론되지 않네,0
6604730,권선징악이라는 주제를 아주 제대로 보여주었던 대표적인 드라마. 탁구의 긍정적 마인드와 윤시윤의 눈물연기가 돋보였었다 b,1
9205756,이영화보고 울다 웃다했던 기억이 나네요! 무엇보다도 인피니트의 멋진 음악과 무대를 생생하게 볼수있어서 더욱 좋았습니다! 인피니트의 무한한발전을 기대합니다! 후속작품도 얼른 개봉하길! 인피니트 화이팅♡,1
9771856,뻔한 불륜을 사랑으로 미화하는 영화들에 신물이 났다. 그리고 이 영화도 불륜 영화가 맞다. 그런데 난 이 영화를 불륜 영화라고 말하고 싶지가 않다.,1
6698849,말도 안되는 영화. 에바 멘데스 벗은 모습만 기억남.,0
21246,최고의 외화시리즈 정말 재미있씀!!,1
9617945,게임 플레이가 죽이는게 스토리가 기가막힌걸로 착각하기 쉽다,0
2378228,로맨틱보단 코믹이 더 강하고 시간 잘간다.. 화장실유머도 웃기고,1
6263131,0점을 주고 싶어 미츄어버릴꺼 같은 영화,0
631432,최고의 의학드라마... 다음편 언제 나오나 목 빠짐....,1
8656899,레알 포스터 개간지 ㅋㅋ,1
6124322,故김득구 선수에 대한 영화를 만든 것만으로도 가치가 있는 영화.,1
7828480,감독이 잘못했네,0
9323528,소름끼치는 한석규씨의 연기.. 새로운 시각의 내용이 너무 재밌어요 왜 시청률이 안좋은지 너무 아쉬운 작품입니다,1
7035213,명작이다!,1
1744181,참신하다,1
6126460,이정도면 양반이지 뭘그래ㅋㅋㅋㅋㅋ,1
7926259,정말 아이들만을 위한 영화다. 내가 아주 어릴 때 봤다면 흥미진진해 하고 너무 좋아했겠지,1
1821583,눈물난다.....너무 재밌어///,1
10007510,그럼 한국인이 하는 꽃집에서 OOO 김치냄새가 난다고 하는게 한국인 비하가 아니고 뭐람..? 겨우 김치발언하나라니..게다가 바보들이 하는짓이라고? 당신이 그꽃집 주인이 당신이었다면 어떨거 같은데..? 보고 안보고는 각자 개인이 결정하는거임,0
8397306,먹고 기도하고 사랑하려면 필요한 것은 돈이죠.,0
10174311,야한영화인줄알고봤는데 재밌는영화였네,1
5348371,허벌나게 재미없네..,0
4877230,장애를 가진 사람에게 먼저 다가가 이해하고 친구가 되주어야 겠다고 다짐했다.,1
9109744,소재는 흥미로워 보이나 상당히 지루함. 긴장감 없는 스릴러,0
9994729,내가본영화중 제일 별로,0
9463458,저때에 제작된 것 치고는 아주 괜찮아요!.2도 나왔으면 좋겠구만.,1
9985703,이런 영화 보면 애 버리..,0
7686137,"연기의 신 이지혜의 강렬한 데뷔작. 그녀는 이영화로 단숨에 전도연,김혜수,손예진,하지원의 자리를 위협하며 톱 여배우의 반열에 올라섰다.",1
9976461,"놓쳤던 연극, 연극을 영화관에서 영화처럼...훌륭하다!",1
8154213,진짜 쓰레기중에 최고쓰레기다 다봣다 근데 미친ㄴ,0
6042061,괴짜스럽고 발칙한 재미가 있는 영화 오르페오 같은 친구가 있음 좋겠어,1
42713,재미를 느낄 수 있다면 싸이코다..--;,0
6181205,보는 내내 지겨워서..ㅡ.ㅡ,0
9804112,사랑하면 삶이 아름다워 진다^^,1
522824,두배우는 너무도 잘 어울린다. 명연기도 .,1
8187899,모냐..~~~어이없는 불륜 영화네,0
6780492,졸작,0
2887376,재밌게 본 영화. 이 영화 덕분에 정태우 초딩시절을 볼 수 있었음ㅋㅋ,1
1140049,한물간영화만 나오네,0
8788232,"오빛나 이남자 저남자 만나는게 이미숙 엄마 닮았군아 쯔쯔쯔... 그리고, 강하준 술마시고 채리를 오빛나로 보이는건 무슨 경우냐?! 교수님도 술마시고 집사를 전부인으로 알고 실수하고말야. 술만마시면 딴사람으로 보이는 설정 대체 언제까지 써먹을거냐??",0
9730399,표절표절표절표절표절,0
8906754,하...미친 존나 재밋어 ....짜임새잇는스토리에다가 ㅋㅋ강추요 긴박한스토리,1
3405649,내용도 없고 지루하기만하네..,0
9288521,끝난건가요결국..아 이제 내주말은 무슨재미로..☆근데 정말 재희랑 연민정 안이루어지나요..내심기대했는데..ㅠㅠ헝,1
10152280,오랜만에 기억에 남는 한국영화 한 편 본듯하다,1
9170541,오늘 보았는데 참 채밌네요!!!,1
6209805,4편보다 나은게 뭐지? 에렌 크루거는 명작들 망치지 말고 공부좀 더 해라,0
3052502,새로움 없이 예전에 많이 보아온 공포물 더 어설프다,0
9887942,아카 킬러죠!! ㅋㅋㅋ,0
8781012,GTA 학교판. 시원하게 쏴죽이네염.. -_-;,1
9764389,볼만하구만 재미있기만한데 영화중간쯤 보다 글올림 더보다보면 지루할랑가 난 아무튼 재밌게보는중,1
3080931,최고임.. ㅠ_ㅠ,1
7689761,서우 생긴게 공포인데 서우가 귀신 아니었음??아 물론 극장에선 않봤습니다 저의 시간과 돈은 소중하니까요 '~ ^) b,0
755134,숀펜의연기 끝내줌. 잼있게 봤어요,1
9710927,최고의 영화 예전에 슛돌이나 피구왕통키같은 필살기 있는 스포츠 만화를 봤었는데 그런 동심을 다시 되살려주는 계기가 된 영화가 아닐까 싶다,1
9246942,이런 또라이 같은 영화가 나오는 환경에 놀랐다..,0
2007870,볼만,0
8076959,더빙이어서 보기도 편하고 애들이 참 좋아했습니다,1
8556964,소소하게 잼있는데 ;;;;,1
9619699,이정도평점은 아닌데...,1
9748732,인사담당자의 해고 전화인터뷰에서 진짜...아...그 인사담당자가 내 앞에 있었으면 인중을 때려줬을텐데!,1
8675761,재밌다ㅋㅋㅋ 진짜 그냥 코미디 현실성 떨어져도 재밌다,1
129009,별이 아깝다...!! 그냥 MTV 에서 보는거와 다를바 없음...!!,0
3752086,무서웠어요,1
4318294,존내 결말없는 영화가 제일 싫다 왠만큼이어야지 똑같은내용 ㅅㅂ,0
9527490,훌륭했던 원판을 능가하는 속편...아낌없는 찬사를 보냅니다.,1
7601856,주인공 디지게맞고 나중에 한방으로 악 물리치는구시대적인 발상 이제는 제발그만짜증나는드라마는처음이에요아역때 그리야무진 삼생이는 커서'드릴말씀이있어요' 후에 말못하는 어버버로..퀄리티좀높입시다,0
10124217,"냄새가 나네요. 영화내용에 대한 평가없이, 동성애자 옹호하기 위한 평점 정말 안타깝습니다.",0
8066978,대중심리에 대한 심도깊은 고찰을 영화로 흥미있게 풀어놓았다.,1
5839584,오래전 보려던 영화가 시간대가 맞지 않아 우연히 보게 되었던 영화. 추천!!,1
7765583,완전재밌음!,1
8204396,재미없어ㅛㅇ요ㅋㅋㅋ,0
8663641,작년부터 기다렸던 코난~~역시 기대를 져버리지 안네요^^너무 재미있게봤네요^^,1
6825185,과거를 반성하게 하는 좋은 작품입니다,1
8815448,정말 감동적인 영화네요.ㅠㅠ 영혼이 없는 프랑켄슈타인 너무 불쌍해요. 여자 주인공 너무 이쁨:: 저런 여자와 결혼하게 해주세요 ~제발,1
9924230,반전 하나 보기 위해 2시간 40분을 봐야하는건 좀...,0
9059264,현대인의 소통과 단절 그 영원한 숙제! 마지막 장면에서 처절하게 울던 양귀매!,1
1953777,하지만 꽤 흥행에 성공했었다는;;;,0
6760509,배우들의 연기력이 매우 부족하다.그럼에도 그걸 커버할수있는 시나리오나 연출이나 촬영또한 없다.감독은 좀 더 배워야한다.,0
3233545,전편보다 쬐끔 나은 거 같긴 한데 그래도 전체적으로 대동소이하다,0
7668474,완전 재밌음!,1
7342601,레이싱의 스릴과 약간의 사랑싸움이 소재인 영화인데 그다지 재미있지는 않음.넘 오래된 영화이기도 하지만 스토리가 너무 진부하다. 스포츠 영화의 뻔한 전개와언제나 빠질수 없는 남녀간의 사랑 이벤트가 사이드 스토리로 진행되는.....이,0
3974853,제레미진짜짱임완전잘생겼다..........베드신은좀약하지만그래도위험하고멋진관계였다,1
7419365,미스터빈이 나와서 1점준다 만약 없었으면 평점주기도 아까웠었듯,0
447740,만화랑 비교해서 보면 재미두배,1
3490860,최고의 비쥬얼을 가진 한국 최고의 SF영화,1
7413227,ㅂ,1
8626540,와~~~진짜 최고의 드라마다..같은남자인데 주상욱 너무멋지네..담주수요일까지 어찌 기다리지? ㅠ,1
6203232,호평만겁나게 많어 ㅋㅋ 칭찬게시판인가,0
8146550,안녕이아니지 나중에보자... 멋지다 아버지에맘을이해할수있는영화,1
4976491,너무한다 증말~~~ -ㅁ-;,0
8832012,그냥본영화그냥본영화,0
2569486,뻔한 스토리에 감동이 느껴져야 할부분에서 산만함의 극치!!!,0
9772862,사람을 쉽게 판단하지말라는교훈 겉으로는악해도 누구나 사람마음씨는 기독교이든아니든 사랑을가지고 있고 조국을위해 헌신한다. 많이 꺠우침을주는 영화내용이다,1
3908729,진짜 최고다 최고 성룡형님 마이 우상,1
5192387,정말 재밌었는데 국민드라마였음 ㅋ,1
3433163,정말 재밌어요.박용하가 너무 멋져.,1
436830,비주얼은 최강이나 스토리는 최악,0
10157725,박보영 헐크 되는순간 웃음 터졌네요,0
