id,document,label
8423973,좋았어요. 영화도 배우도.,1
9470559,평점이 너무 높음. 포스터 글귀에 낚이면 안될듯.. 그냥 잔잔한 내용에 3류 멜로물.. 사실 s신말고는 볼께없음.,0
4278898,손발이 오그라드는 유치함 진짜 쩐다 쩔어 정말비추,0
9539394,정말 21세기 꼭 봐야되는 최고의 영화라고 생각한다.(말이 필요없는 영화!!),1
9276283,유해진은 좀 모자란역인가??,0
1645863,소재는 좋았는데..,0
1593494,만들면서 되게 귀찮았나봐?,0
1551820,영화에 몰입이 안됩니다,0
5705123,개 쓰레기 .. 내생에 본 영화 중 최고의 졸작.... 쓰레기인걸 알면서도 본 난 뭔지,0
1805783,기대안하는 이유는 드라마봤는데 스토리가 왔다갔다하니까 짜증나,0
1694874,재밌구만.. 뭔 말들이 많냐? 걍 쳐봐라,1
8497234,추억의 영화 너무 재미있게잘 즐겨 봤데이 역시 터미네이터 성님까리하제 ㅎㅎ,1
6133023,개망한 영화. 보면 왜 망했는지 알 수 있는 영화,0
8673735,대역이고 뭐고 영화예고편 자체가 낚시쩌러. 차라리 케이블에서 해주는 19금 단편보는게 훨나을듯.,0
3934812,참 감동적이넴,1
10035068,살면서 지금까지 이 영화를 안본게 후회 될 정도로 명작이다.최민식 연기는 레전드급bb,1
9846929,비정상회담엠서 러시아로 나온 사람이 자기네 나라는 부정부패가 들 끓어서 시민들이 정치에 관심을 잃었다던데.. 영화보다가 그 말이 막 생각나대. 이게 그 나라의 현실인가보다,0
6834953,"아진심 개OOO..내가 첨으로 친구한테보여준영화인데 보면서 첨으로 잠들었다,,.아",0
8599188,효민 연기못해서 못보겟어 레알,0
10153405,학교 동아리 시간에 선생님께서 이 영화를 보여주셨는데 그 날 머리속에 OST가 계속 생각나서 미치는 줄 알았어요 그래서 지금까지 몇달 동안 계속 흥얼거리는 중입니다~ 제가 들은 OST중에 최고인듯해요. 진심으로요,1
8909283,영화를 본 후 치밀어오르는 분노를 자제하려고 노력했다.,0
335036,많은기대를 져버리는 영화...아쉬움이 많이 남는 영화...,0
7233248,ㅡ.ㅡ,0
1111097,스토리를 외우게된 영화.,1
10213049,언제나 이병헌은 자존심도 없이 허리우드의 악역 조조연역만 하고있으면서 언플질 대단하지.,0
4503990,초기는 좋았는데 최근에는 정말 무슨 재미가 있는지 1박2일 최고의 시청률이지만,0
9839703,평점이 말이 안되는데 .. 말도안되게 낮아 ..,1
7529837,쓰레기.ㅇㅇ,0
5945205,아오이유우보는맛으로봣어요,0
2959685,어릴적 이영화 보면서 펑펑 울었던 기억이 나네요 정말 최고의 영화던거 같아요,1
9687991,따뜻하고 가슴이 먹먹해집니다.,1
10167907,차태현 짱!!~엄청 재미있어요!!,1
1685742,기름지다..,1
9987793,". 한 인간의 내면적 갈등과 그에 따른 변화를 잘 서술한 작품이라 생각합니다. 마지막 부분, 전도연이 자해를 하다가 깜깜한 밤하늘 아래 나와서 살려달라 외치는장면,가희 백미엿습니다. 깜깜한 밤하늘, 우리를 비추어주는 별 하나 수놓고 갑니다.",0
8542095,존 노 잼 영환데 서사가 없다,0
6270039,연기력을 떠나서 스토리 또한 괜찮다고 생각됩니다. 물론 연기력이 70%,1
7449568,잼나게보고있었는데.... 왜이리 질질 끄나요? ㅡㅡ 연장도 정도껏따야지.... 언제까이 짜증내고 울기만하나요?,0
6186724,그저 웃지요 -_-;,0
4959712,내돈으로 안봐서 다행,0
10016671,이건 뮈 줄거리도 없고 유지탠 바보도 아니고 현실과 넘 동떨어진 ㅠ,0
3989078,욕 나오는 영화다...,0
9583031,REC라는 타이틀만 이용해먹은 영화.,0
8613246,막장드라마냐?.. 아침드라마보단 좀 낫네... 그래도!!! 싫음,0
9810828,이거 완전 이블데드급의 코메디 3류..,0
7739254,간만에 욕하면서 본영화 ㅡㅡ,0
7990117,다같이 푸춰핸섭~!!!!!!아비조~~~!!!,0
3861985,전편에 비해 정말 재미없다 -_- 잔인함도약하고 포스도 떨어진다,0
9522199,보는데 울화통터져 죽는줄 아랐네ㅡㅡ,0
9409870,KMDB 한국영화데이터베이스에서 상영중입니다 방금 보고 와서 댓글 남김니다...보다가 눈물이 났네요,1
9286608,오늘 개도둑 잡고 한건했네요~~!!,1
7579444,왜봣지 ㅡㅡ,0
8085873,알바가 조작한 평점 깍아 드려요,0
6579507,재미있음,1
10258774,어쩜이렇게재밌을수가있지.. ㅠ너무감동,1
419906,볼만하다,1
4674129,3.14를 위해,1
9923534,오우삼감독치곤 잘만든영화,1
9204888,원작에 애정 없는 감독(그것도 에머리히)에게 리메이크를 맡기면.,0
1919084,책은 재밌는데.... 영화는 젓같다.,0
10275720,아돌겟내 존나재미없어씨ㅡ이발 2기는왜쳐만들어,0
2554666,이런류의 애니메이션중에 가장 지루했던 애니메이션으로 기억된다.,0
4430039,GOOD 휼륭하다 영상미가 아주 뛰어난듯,1
711366,재미있는 소재를 살리지못한 유치한 코미디 영화.,0
3873714,참 잘했어요,1
6361614,중간에 꺼버릴 수 밖에 없었던 영화.,0
9712636,오타쿠같지생긴감독!!,0
6655441,성별 평점 보면 답나왔네 여자들이 좋아할만한 영화이기보단 배우를 좋아한건 아닌지 털끝많큼에 감동은 없었지만 이해할수없는 내용으로 시선 끌기엔 좋았다,0
400031,지루하고 매력없는.,0
7517621,엠비씨 OO같은건 진작 알았지만 요즘 더 최악이다 아침드라마 사랑했나봐도 이따위로 일만 벌여놓고 결국 코메디로 끝났지 벌여진 사건은 해결못하고 여자가 정신병있는 걸로ㅋㅋㅋ 이것도 꼴 보아하니 그렇게 끝나겠다 외계인 안나오면 다행이고 엠비씨OOO,0
1776619,그녀의 매력이 상큼하게 톡톡 튄다.,1
5863013,현지 영화 전문가들도 두손 두발 다들은 망작 이런걸 개봉한다고?,0
9143683,드래곤볼은 10점도 과분하지만 더빙은 좀 아니라서 1점깎음ㅋ,1
7341275,444,0
8095561,잘 봤습니다. 저도 보면서 힘을 얻는 영화라 생각이 드네요,1
5882155,이런 영화는 도대체 왜 만드는것인지,0
3587725,얼렁뚱땅!! 좌충우돌!!,0
4452600,솔직히 굿 ㅋㅋㅋㅋ 넘버11씨는 살아남길 바랬는데 2번째극장판 어서 나오길,1
7750165,"강철을 황금으로 만들어 흥하는 연금술사는 아니지만, 등가교환의 원칙을 철저히 지키는 연금술의 평범한 진리를 깨우쳐 준다. 과욕은 그만큼 나에게도 문제를 일으킨다는 사실을 잊으면 안될것이다.",1
3023629,뼈와 살이 분리된 느한방에 느낌!!,0
9827965,총알이 없어 소금이 있다,0
10066849,이 영화가 자신의 인생에서 최고의 영화가 되었다면 제대로 본 거다.,1
9875775,보면안다 그렇가 꼭 보길바란다,1
5053808,너무 너무 좋네요!,1
3071232,"소름 끼치도록 몰상식한 영화, 기대를 져버리기 안성마춤",0
1371055,"뻔한스토리, 시간만 낭비했다.",0
9888577,유치한 내용이라 생각했지만 막상 보고 나니 정말 은은한 감동이 있네요.,1
7576445,골때린다 진짜 ㅋㅋㅋㅋㅋㅋ,0
5813205,파라노말 액티비티2 만큼 재미없었.. 그래도 구지 선택하자면 파라노말2,0
8555628,재미없어요. 이야기를 쓸데없이 지루하게 끌었ㅇ어요,0
10009756,중간부분부터 봤는데 그래도 지루하고 재밌었다매즈 미켈슨 연기가 좋았던 거 같다,1
3910655,요즘 이런 영화 보기 힘들다. 시간이 지날수록 공감하는 사람들이 많아질것같다,1
105503,거기 구미호 좀 집에 좀 가지?,0
9611562,병맛 . 기분드러워지고 싶으신들 보세요,0
10151722,잔잔하고 재미도 있어서 좋았다,1
6186466,시나리오 잘 썼다고 생각했겠지,0
8549676,조폭미화와 병맛ㅋㅋㅋ,0
2327820,료코나오는것중엔 젤 재미없더군요. 솔직히스토리는삼류...,1
6674370,효민이 평점 시청률 다 까먹는구나 ㅠ~~,0
9405607,스토리로 보자면 일단 정말 개연성이 없고 끝에 정말 허무함 연출을 평하자면 역시나 개연성이 정말 부족하고 씬과 씬이 넘어가는게 독립영화보다도 훨씬 매끄럽지 않음. 인물 캐릭터도 그냥 1차원적임 많이 공부좀 더 하세요 감독님,0
4744755,판에 박힌 디즈니 만화 표정들만 잔뜩... 줄거리의 새로움도 없네,0
7566588,아구슬퍼라... 진짜 마지막 부분 짠하네요.. 이상한댓글들 다는사람들.. 영화는제대로 보신건지;; 안타까움;,1
9788738,올해 마흔인 내가 봐도 재미진데... 왜들 다 평점에 이리 박하실까...,1
5379202,영화과 과제로 3년동안 본 영화중 최악.,0
8732663,아진짜 극장에서봤는데 쥐나와서 춤출때 나올때 개식겁ㅋㅋㅋㅋ멍때리는게더재밋음,0
10101773,ㅋㅋㅋㅋ이게영화인가,0
6081944,매니아 쪽이라면 흑돼지는 싫을거다,0
3385824,"'안녕~또 만나요~'라는 말이 나오고 몇 년뒤에 이상한 우뢰매가 나옴 ㅡ,.ㅡ;;",1
10072687,아이가좋아해서재밌게봤네요,1
9721662,깔끔하고 귀여운 영화 연출이 너무 좋다. 별 생각 없이도 시간 가는 줄 모르고 본 영화,1
7651461,"정말 훌륭한 영화같다. 당시 몰매좀 맞기도 했지만, 다시 보아도 역시. 다만, 나의 이해도가 딸려 10점을 줄수가 없네.",1
9845788,시 읆는 장면이 클라이맥스지.,1
176095,내용은 좋은데..좀 야한것과 엉성한 모습이 좀..,0
9096541,쇼미더머니재미는잇는데...아바스코자신감?쩔 저게락이지..어째힙합이가이번에 차메인은모르겟구 바비잘하더만아바스코님..존경하지만 고집쟁이 산이불썅,1
1643833,"어쩌다 봤는데, 전위성과 포스가 몰아친다. 청춘의 80년대",1
9790626,"최고 ㅠㅠ 곳곳의 감독의 철학과 상징이 엿보이네요. 자신의 특별함을 믿고 새로운 돌파구를 찾고 싶지만 현실에 부딪치고 아무도 자신을 몰라준다고 느낄 때의 막막함을, 그래서 그녀의 선택을 더 잘 이해하게 되는 것 같아요 두 주인공 모두 이해가됐어요",1
2341668,솔직히 말도 안되는 영화...... 아만다바인즈떄문에 반개 줌........,0
7958780,무조건 추천,1
9136955,짐작대로 그만큼. 흠흠.,0
10003196,진짜 디즈니 같은 영화다 영화가 이렇게 길게 느껴지긴 처음임ㅇㅇ,0
891552,영화티켓은 있는데 무슨내용이였는지 전혀..,0
10210189,"데이빗모스를 싫게 만든 영화... 왠만하게 욕먹는 영화도 괜찮게 보는 성격인데, 이 영화는 정말 최악이다. 사람 시간 버리게하는 영화는 좀 제작을 자제했으면 좋겠다. 항상 모든 작품은 각자의 입장이 있다는 것을 인지하지만, 정말이지 이해할 수 없는 작",0
7788012,원작의 방대한 양을 2시간내로즐이려니까 영화가 이모양이지……ㅡㅡ 엄청 빠른 전개 뭐가뭔지하나도모르겠음 그래도 저금은 재밌었으니 2점,0
8786299,강원도가 만만하나? 영화 한 편으로 고향 이미지를 아주 그냥..,0
7616838,아진짜박보영씨하고송중기씨평소에정말정말팬이지만더빙은하지마세요,0
8157986,내가 태어나 본 사람중에 가장 이쁘다고 생각한 사람이 올리비아핫세인데... 이영화에서의 소피마르소의 미모는 이미 인간사가 아닌듯 싶다. 여신그 자체인듯하다;;;,1
10112284,미쳤당미쳤어 진짜 연기쩔어,1
2557684,부활보다는 조금 못하지만 그래도 멋진 드라마!,1
4850310,대박,1
7697282,가족하고 같이 보았는데 내용 및 구성도 탄탄하고 이야기도 흥미로웠다. 비속어를 조금 쓰자면 '졸잼'?,1
7921599,남는게 하나도 없다,0
10013954,하.. 시간 아깝다.. 잠이나 잘껄.. - -,0
5675749,요즘연하남들이다정신 나간줄아는 또 하나의 식상한드라마!이혼한 작가들의로망아냐 ?,0
8183051,볼게 아무것도 없네요 장난허나 ㅡㅡ,0
10224065,이거 본지는 좀 됐는데 요즘은 이런 멋진영화 안나오는듯... 감상평은...정말 뭔가 깊이있고 큰 무언가을 본듯한 느낌? 평론가들은 뭘보고 평가하는건지..;;,1
10214829,2007년 시즌 1때부터 즐겨본 유저입니다. 영애씨 나이도 저랑 비슷한 또래라 많이 공감갔는데요. 정말 오랫동안 기다린 드라마네요. 부디 초심 잃지 말고 재밌는 드라마 부탁드립니다. 응원하고 또 사랑합니다. 부디 예전 막돼먹은(?)영애씨가 보고싶네요,1
8085245,첨에 좀비 어찌고 저찌고 아무튼 보면 개후회하는 영화,0
9953981,기대되는 영화네요 여자주인공이 이뻐요,1
7445157,"고 이수현 씨의 인기를 이용했다. 추모하고 기린다는 취지는 좋지만, 지나치게 한국인을 치켜세우는 민망한 내용... 적당히 미화하고 살을 붙여 단순 인간 이수현을 넘었다",0
4599151,앨고어 사기죄로 고소당함 이영화는 쓰레기영화에요,0
9588466,"노래 좋고, 무엇보다 찌질하지 않고 참신하다.",1
2845310,지루할수도 있겠지만 집중해서 내용을 알아가면 정말 소름끼치는 영화,1
9129003,저번시리즈도 좋았는데 이번에도 꿀잼ㅋ,1
3320641,영화 실제 인물인 수잔 브링크 씨가 암으로 투병 중 돌아가셨다고 하네요..,1
6963656,이게 평점 8점이라니..,0
3211493,"자기 자식 하나 때문에, 대체 몇이나 죽어야 하나... 이기주의의 극치..답답한 스토리",0
7786670,지금까지 청소년 드라마중에 최고다.,1
5293987,주제를 생각하며 보는 저는 개인적으로 너무 괜찮았던 영화. 기대 안했는데 너무 재밌,1
1820129,조낸재미없그렁 싸이먼으로 나오는 애기장애인.........아진짜이상했음,0
850604,쓰레기....보고후회하려면 보던지.....,0
7157230,내가 진짜 영화보고 시간낭비했다 생각해보는것도처음이네.... 이걸 영화라고 찍은거니?,0
5567672,진짜 재미없음.... 배우들이 아까운 영화,0
187204,너무 진부한 스토리.. 도대체 관객에게 무엇을 전달하고 싶었던 것일까..,0
7426888,이 영화 정말 한국에서 개봉합니까?믿을 수가 없네요.저질인거 같고 더러운데 이영화 잔상이 의외로 오래남아요..흔히들 이반이라 칭하는 이들을 달리보고 있던 스스로를 한번쯤 돌아보게 합니다.수위가 좀 남다르단 단점이 있지만 나름 괜찮아요ㅎㅎ,1
8937087,으아 나만 재미없었나...,0
9931873,늑대소년이왜나오냐ㅋㅋㅋ 마치카페베네빙수와 7성급두바이호텔 금가루빙수의차이임. 장르만같다.,1
4852555,감독 밸류에 비해 지나치게 초라하다.,0
6274599,머리아프지도않고 너무~~~~~~~~~~~재밌다,1
7898446,진짜 쓰레기,0
9223412,꿀잼... 시간가는줄몰랏음 그ost가 여기서나온거엿구나,1
6150798,펑펑 울었다.,1
8540233,이게 드라마??? 퀄리티가 이정도일줄이야....,1
3980031,쿨한 성격? 내가보기엔 어처구니 없다...내용 또한...,0
10248773,이것을 보자 기공을 모을 수 있게되었습니다,1
3838727,걍 그래요,0
9291618,보면서 2014에 만든건 아닐꺼야 했는데...ㅎㄷㄷㄷ2014년작 이었음..,0
5961187,초반부는 굉장히 재밌다 하지만 갈수록 과장히 심한액션과 유치뽕작을 넘나든다,0
5437452,"다정한 아버지 귀여운아들의 마지막여행 ,황홀하기그지없다.",1
2743782,일본판고지라는 미국판보다 몇OO은 먼저 나왔고 미국이 배낀거임,1
9968257,태어나서 이렇게 돈아까운영화는 처음이에요. 중간에 10분정도 이상한 의식하면서 토하는장면소리 엄청나오는데 진짜 영화보다 혐오느낀적은처음이고 이렇게 시간돈 아까운건처음이에요. 예매율이낮은건 작품성을몰라본게 아니라 재미가없어서입니다. 결과엔 이유가있는것.,0
4999750,good good~ 일본 영화를 다시 보게 되네요^^,1
899172,너무하네...-_-,0
5779020,"어린시절 주말의 명화에서...음악영화들이 많지만, 인상깊었던 몇 안되는 영화네요.",1
2667241,진지한듯 어설픈~끝이 보이는 치졸한 결말,0
7269551,조승우 너무좋닿ㅎㅎㅎㅎㅎㅎㅎㅎㅎㅎ^^,1
6990052,가면속에 감춰진 사랑이야기...,1
9086242,호아킨 피닉스 ‥ 너무도 매력적인 남자 그가 맡은 역할은 언제나 살아있다 너무도 현실적인 영화속에서,1
172721,"일본오리지날판>미국판>한국판.. 정말 연출,연기 모두 최악이다..-_-;",0
10247655,아 새벽 4시44분까지 이영화를 보려고 밤샌게 한심스럽다,0
10159251,"더글라스와 커티스의 연기력으로 좌중을 압도하고 동시대 작품특유의 영상미로 아름다움을 더하는, 현대의 진부한 영화들 속에서 오랜만에 안겨온 가뭄의 단비 같은 명화.",1
7900057,원작을 안봐서 내용을 확실히 모르겠지만 확실히 이해가 안되는 영화기는 하내요. 스토리가 많이 빠진것 같고 이해도 안되고.. 갑자기 이해하기 힘든 내용들 나오고 뒤죽박죽 섞여있는 것 같아요. 그래도 추천하는 분 있어서 봤는데 비추입니다. 시간아까워요.,0
6723572,이게 뭐다냐 이딴게 6점이나 한다고?,0
9183458,더 낮은 점수가 없다는 게 아쉽다,0
6779473,"시사회 다녀왔습니다.어린애들이 쓴 인터넷 소설같은 내용과 부자연스러운 전개, 발연기까지.. 진지한 장면에서 관객들 웃고 난리났었습니다.그래도 노래는 좋았어요.......들어보세요.......환희 화이팅.............",0
7904420,생각보다 별로네요;;;; 왜 이렇게 평점이 높은거죠??,0
87316,제발 한국영화 예술이 어쩌네 저쩌네 하면서 주접떨지 마라!!!!!!!!!,0
3431523,뭐 어쩌자는 이야기냐..,0
10001569,처음으로 주는 10점.,1
4365959,좋잖아,1
10149214,크 우리나라에 이런영화가 나왔다었다는건 역시 대단하다 진짜,1
9988835,ㅋ 우스운영화를보았음..한국공포가 왜이래 한30년전에찍었었나..제대로보여주는것암것도 없네.글쿠시작하자마자 남자에 농간이란게바로보이더만.,0
9212110,지금 1만원 결재한거 틀어놨다..ㅠ.ㅠ,0
8091550,원작이랑 비교는 애초에 분량상 무리인듯. 저는 그래도 재밌게 봤습니다. 제 점수는요,1
9900025,우연찮게 케이블에서 하는거 보게됐는데 배꼽 잡으면서 봄. 필히 자막 나오는걸로 보길,1
9326862,킬링 타임용. 수준 낮은 연출 많다. 3류. 뭐 잔인한 스릴러물 답게 몰입은 됨. 시간 날리기에 적당. 이딴 영화 추천 짜증나네.,0
8809798,옛날영화라 그런지 과장이심함 평점 너무 높아,0
9819347,다채로운 색 표현으로 보는 내내 눈이 즐겁다. 여자가 용기 내어 진실을 말하지 않았다면 지금까지 누구도 모를 것 같다.,1
6852435,ㄱ냥 매번 긴장되고 재밋음ㅠㅠ,1
297077,욕망이라는 이름의 전차.,1
5784710,머하자는거야... 무조건 마징가가 이기고 끝나는 유치한 상상은 그만 합시다.,0
5444351,"말로 하면 입만 아픈, 보고 느껴야(만) 하는 걸작. 도저히 잊을 수 없는 첫 장면.",1
4719744,무슨 연애비법은... 여자주인공은 끝까지 혼자 잘난 맛에... 아무하고나 잠자리 갖는,0
7039882,스릴넘치고 마지막엔 정말 감동..,1
10062839,아니 어떻게 87년도 영화 보다 못하냐 ㅡㅡ 여주만 이쁘네 왕조현 장국영 그립다 ㅠㅠ,0
6064038,진짜 재밌었어요! real very good!!!,1
5636,바보들이아니고 정말 잘했다,0
6058260,우리나라였으면 가정파탄이지..,0
9976028,너무 난해 너무 심오 어려움,0
3966848,존네 울었네 ㅠㅠ,1
426073,한길수 온국민이 알아야 할 영화,1
9888897,이민기 주연 = 부도 보증수표. 불변의진리ㅋㅋ 이민기의 주제넘은 의ㅈ감별논란만남은 희대의 졸작. 민기는 치졸하게 뒤에서 의ㅈ이네 뭐네하면서 더받았다고 열내지말고 제발 너나 똑바로하길바란다ㅎ 니가 왜 3.5억씩받음? 받아도 이태임이 받아야하는거아님?ㅋㅋ,0
5521855,신선한 영화 였음 ㅋㅋㅋ 재밌넹ㅋㅋㅋ,1
9207253,"솔직히 8점이상은 되야함. 전 리메이크작들을 본 사람들은 모르겠다만 처음 본 사람 입장에선 초반부터 끝까지 몰아치는 스릴감, 흡입감 모두 장난아니었다. 오히려 장황한 과학적 설명들을 축약하니 스릴에 더욱 집중할 수 있었음",1
9875714,모리 준이치 감독의 영화는 정말 다 최고. 란도리 안보신 분 란도리도 꼭 보세요. 주인공들의 독백이 정말 최고. 이런영화 계속 만들어주시길,1
3275857,멧돼지 고기 먹을때 맛있게 먹더라 공감 ㅎㅎㅎ,1
9486956,오늘 세상에이런일이 바위에서 사는남자가 집이 2곳이나 있다.,1
9890237,진짜 숨죽여 보게 만드는 최고의 영화였다.,1
9391436,"너희가 그리고 우리가 이 인생에, 영화에 주인공이다",1
8243870,진짜진심으로화나서심장이벌렁거린다...,0
1597757,이거 완전 내스탈 아님!! 블랙코메디야?,0
4566193,장백지를 좋아하게됐던 영화. 판타지애정물의 시초가 된 영화. 마이 슬퍼~,1
9546696,영화 시작 부터 끝까지 명장면으로 차있는 것 같음,1
2401224,사악만발 엽기 (삼류) 코메디 . 초짜 감독의 한계. 그냥 팝컬럼니스트나 하시지..,0
4209642,4차원 드라마..그래도 재미있었다..,1
9127888,장난하시네요.... 이걸영화라고 탑순위에 올려놓다니케이티 영화 그지 같은것만 올려놓는거 인정한두반 낚인게 아니라 억울함,0
4058440,많이 재미 있음,1
7530632,최근 볼만한 영화가 없었는데 괜찮게 보았다. 이정도면 웬만한 스릴러 영화들보다 괜찮은편인데.. 평점 낮게주는사람들은 영화 이해를 못한건가? 8점이지만 평점올리기위해 10점,1
10124219,진짜 대박영화...감독 천재...영화 끝나는 내내 지루하지가 않았다.,1
5406482,5점준놈 생각좀해 78년작인데 ㅡㅡ 멀더바래,1
7546351,지체 장애 액션과 시각 장애 스토리,0
6569040,영화가 지루하다...,0
9751866,인도영화는 믿고 거른다,0
4814547,좋은데.,1
7862848,토니죽지마ㅠㅠ..,1
8679355,1점도 주기 싫은 졸작. 평점이 영화에 비해 왜이렇게 좋은지 이해할수없다,0
1575888,제시카 알바. 역쉬.. 알바나 해라...,0
834843,내 평생 이렇게 재미없는 영화는 처음이다,0
7356380,목소리가 영화를 이렇게 망칠 수도 있구나 생각이 드네요.,0
5996190,막판 심판의 개드립이 대박.. 각본 누가 썼는지 궁금하다,0
5695320,"정서적으로 공감이 안되는 부분이 있지만.. 배우들의 명연기, 대사, 유머와 재치 최고",1
9412983,kbs에서 해줘서 보고있는데....킬링타임도아닌... 나지금뭐하고있지? 깨달아주는영화ㅡㅡ,0
8119639,이휘재 하차하라.이휘재땜에 세바퀴 보구싶어두 안봐.,0
6144936,시청율을 의식해서인지 진짜 별로였다.,0
5302077,좋다,1
9898962,퇴보 된 한국영화들...씁쓸하다,1
10080079,다시 볼수있을까... 이런드라마,1
6745875,그냥 딱 3점짜리 영화ㅋㅋㅋ,0
5880042,에라이.. 환멸.,0
3900039,돈이라면환장을하는여자들부자들의첩이못되어서안달을하네OOO들,0
4211122,현재 tv시트콤 수준이 얼마나 높아졌는지 알 수 있는 따분한 코메디영화...,0
8721509,수준급이긴 하지만 7점정도가 적당하다 내려가라,0
9271144,간단하게 정리하자면돈 주고 보지 마세요.,0
4642395,최진실이 가장 아름답게 나온영화인것같다!! 이영화보고 완전 팬됨!!!!,1
9959077,남배우 비주얼에 10점,1
5574954,나도 모르게 돌아가는 채널,0
3863032,천재적 지능을 가졌어도 결국 인간은 사랑받고 싶어하는 것이 본성인 것 같아요,1
9854133,이야기가 화려해진 비주얼을 따라가지 못하는군,0
732837,왜이러세요..안그러셨잖아요....,0
8198773,"영화니까 각색들어가고 고증 어긋나는건 이해하겠는데, 김희선 앞세운 마케팅에 낚이지 마. 걍 단역이야.",0
9442360,"요즘 드라마도 홍수, 예능도 홍수라 오히려 다 거기서 거기라 식상하다 그래도 아빠 어디가는 넘 신선하게 다가왔고 따뜻하고 진솔해서 좋았다 그냥 웃고떠드는 예능이 아닌 1년동안 아이도 아빠도 변화하고 성장하는 과정을 자연스럽게 보여주는 참 좋은 프로다",1
5402576,캬.. 굿.ㅋㅋㅋㅋ,1
3719500,서양 코메디는 웃기지 않다는걸 다시 한번 느끼게 해준 영화..,0
9423084,자게 성지순례 왔습니다.,0
3869802,"가슴 속에 잔잔함만 남는 영화, 잔잔하게 아름다운 배경과 이야기",1
9155746,하 영화보면서 울었던 적은 처음... 진심 이런 개와 주인 사랑합니다.개가 역시 사람보다 나을떄도 있네요..,1
9688768,별 기대 안하고 보긴 했는데 의외로 재밌게 잘 밨습니다,1
8619575,드라마는 드라마로만 봐야지요 ㅎ 재밌습니다~!,1
5762638,너는 맛을 그릴줄 아는 능력이 있다.,1
4231670,넘넘 감동적이에요.....ㅠ.ㅠ,1
8949290,어렸을때 티비에서 엄청많이봤는데..개명작임 이건그냥진짜,1
